topic,level,question,optionA,optionB,optionC,optionD,correctOption,explanation
Solar System,1,Qual é o planeta mais próximo do Sol?,Mercúrio,Vênus,Terra,Marte,A,Mercúrio é o planeta mais próximo do Sol, localizado a aproximadamente 57,9 milhões de quilômetros.
Galaxies,2,Quantas galáxias existem no universo observável?,100 milhões,1 bilhão,100 bilhões,2 trilhões,C,Estima-se que existam entre 100-200 bilhões de galáxias no universo observável.
Black Holes,3,Como se forma um buraco negro estelar?,Colisão de galáxias,Colapso de estrelas massivas,Explosão de supernova,Formação de planetas,B,Buracos negros estelares se formam quando estrelas massivas colapsam após esgotar seu combustível nuclear.
Stars,1,Qual é a estrela mais próxima da Terra?,Sol,Próxima Centauri,Sirius,Alpha Centauri,A,O Sol é a estrela mais próxima da Terra, localizada a 149,6 milhões de quilômetros.
Cosmology,4,O que é a energia escura?,Tipo de matéria,Força que acelera a expansão do universo,Radiação cósmica,Partículas subatômicas,B,A energia escura é uma forma hipotética de energia que causa a aceleração da expansão do universo.
